{"allowedUseClasses":["development_attribution_prototype","development_diagnostic_scoring","development_mutation_dry_run","development_external_evaluation","governance_audit"],"artifacts":[{"artifactId":"after-component","artifactKind":"component_manifest","contentHash":"cm-sha256:70d215c416ba67c10dc2d58b37f6f4ec6f98f5f3b906178daa5e97ff336491da","path":"architect/evidence/development-attribution-dry-run/after-component.json"},{"artifactId":"after-payload","artifactKind":"component_payload","contentHash":"sha256:b98f05a83d1bbb058f4222815e8083f41005aa7cb7bd6cd8dbd2e8bfcb092dca","path":"architect/evidence/development-attribution-dry-run/after-payload.json"},{"artifactId":"before-component","artifactKind":"component_manifest","contentHash":"cm-sha256:a57531b137deafb9ab4cb98dffec745399dae0a1dfca93a3e35b1c375459ea82","path":"architect/evidence/development-attribution-dry-run/before-component.json"},{"artifactId":"before-payload","artifactKind":"component_payload","contentHash":"sha256:781fde3486d64093766dc7b5e09a390a781251eac28cf5f8b79dab40590ed81f","path":"architect/evidence/development-attribution-dry-run/before-payload.json"},{"artifactId":"candidate-harness","artifactKind":"candidate_harness","contentHash":"hv-sha256:4d16c0eae8fce973187a26c43ba44a52ab32a539619e278d7c38eb375cdb5089","path":"architect/evidence/development-attribution-dry-run/candidate-harness.json"},{"artifactId":"evaluator-request","artifactKind":"evaluator_request","contentHash":"sha256:9f8ff2abdf4f270be3af47013df41f87f70b0c614ff94a3e5b8cdc676d98ff3c","path":"architect/evidence/development-attribution-dry-run/evaluator-request.json"},{"artifactId":"evaluator-result","artifactKind":"evaluator_result","contentHash":"sha256:2a5e28f3283dec5f886de921da8046af2518c19251cd88689a62dd3b44483b88","path":"architect/evidence/development-attribution-dry-run/evaluator-result.json"},{"artifactId":"evidence","artifactKind":"development_evidence","contentHash":"sha256:31a2e8ca0506e8d60e41bc7df07de118887dfae4aced965f36fcc0f0b6b7ba5f","path":"architect/evidence/development-attribution-dry-run/evidence.json"},{"artifactId":"mutation-dry-run","artifactKind":"mutation_dry_run","contentHash":"sha256:c15b27c3c551b8689d0c26db70d724a2bc3372c1b3636fdf8ac707de983c489a","path":"architect/evidence/development-attribution-dry-run/mutation-dry-run.json"},{"artifactId":"non-promotable-record","artifactKind":"non_promotable_record","contentHash":"sha256:3b6043b2776df22680b9d669ce3861b076a259b690a29bb8ba8fc254cd37d347","path":"architect/evidence/development-attribution-dry-run/non-promotable-record.json"},{"artifactId":"oracle-access-event","artifactKind":"oracle_access_event","contentHash":"sha256:60ff1831f5ba1fed769ab1c58e3464e318d070364ebf493731936f41c1713079","path":"architect/evidence/development-attribution-dry-run/oracle-access-event.json"},{"artifactId":"parent-harness","artifactKind":"parent_harness","contentHash":"hv-sha256:41691e5ba96081a7bb0d2d3bce93402d643a21a0b3c5a637a43e7c9715d87f33","path":"architect/evidence/development-attribution-dry-run/parent-harness.json"},{"artifactId":"permission-component","artifactKind":"component_manifest","contentHash":"cm-sha256:ec4589ca253b2766679096f61d08f2f58dccf2dd832a42432ec51e7bcff2e365","path":"architect/evidence/development-attribution-dry-run/permission-component.json"},{"artifactId":"permission-payload","artifactKind":"component_payload","contentHash":"sha256:61fe04de13d2511492c448c6c857fababb685fedef374d4806d99e91b9dcae4c","path":"architect/evidence/development-attribution-dry-run/permission-payload.json"},{"artifactId":"prediction-commitment","artifactKind":"prediction_commitment","contentHash":"sha256:583fea8371ac7a7b5a68470a535c89adbb5aa9ce8fcc4d4157bea46b7ceac393","path":"architect/evidence/development-attribution-dry-run/prediction-commitment.json"},{"artifactId":"prediction-set","artifactKind":"prediction_set","contentHash":"sha256:530c5393f706f1af06fe084d834cb7ca84dffc4b2b642961af9ac3aa44d1b92d","path":"architect/evidence/development-attribution-dry-run/prediction-set.json"},{"artifactId":"prototype-manifest","artifactKind":"prototype_manifest","contentHash":"sha256:4eb086841a2f8f95835173a645ac0826e8b74586ffdd2635c40aef824cd78933","path":"architect/evidence/development-attribution-dry-run/prototype-manifest.json"},{"artifactId":"score-report","artifactKind":"development_score_report","contentHash":"sha256:3e56f58bf7fbc8eb3e6ea3fd37820629c22f8b292c7a520d2e4298ab73f0da2c","path":"architect/evidence/development-attribution-dry-run/score-report.json"}],"attestation":{"algorithm":"Ed25519","keyId":"protocol-author.development-artifact-quarantine.development-ed25519","signature":"cxWhK5OyZxCOqQqF-ni_eD6v8PkqkINHslCZjf4W_HpEVR6cVWBpJFL0EDUy0rAAxm2s_WStrCL8fQ_Wh4E4Aw"},"authorizationDecisionHash":"sha256:19d1998f6207ba0f67095be9ed21ff649b35c6523aedb165715694c1115d6e74","claimBoundary":{"attributionPerformanceClaim":false,"authorizedForResearchEvidence":false,"confirmatory":false,"developmentOnly":true,"publicVisibleFixtures":true},"prohibitedUseClasses":["research_protocol_manifest","attribution_gate","research_threshold","research_candidate_selection","promotion_decision","canary","deployment","production_pointer","claim_table","research_evidence"],"publicPrincipal":{"identity":{"identityDigest":"sha256:89828ca81a0c50be1d3431fe36db680e9a596b42086b206b5fda49b9a52a0ee1","implementationDigest":"sha256:2253465cea11924c0a3b0b32f0c0b31edf9784fad87e1f23634a19c63bc3eca8","instanceId":"protocol-author.development-artifact-quarantine.instance","principalId":"protocol-author.development-artifact-quarantine","role":"protocol_author"},"keyId":"protocol-author.development-artifact-quarantine.development-ed25519","publicKeyPem":"-----BEGIN PUBLIC KEY-----\nMCowBQYDK2VwAyEAW4ZJwM/Nvnil/5Yu36SJFN/UWvIq/jWN4fTdfkVn1co=\n-----END PUBLIC KEY-----\n"},"recordHash":"sha256:8f92524960e1e57528ac89a5da981caa30d92e23d1180486b7631109d9ddf3da","recordId":"development-artifact-quarantine.attribution-mutation-dry-run.2026-07-31","recordType":"development_artifact_quarantine","recordedAt":"2026-07-31T08:06:00.000Z","recordedBy":{"identityDigest":"sha256:89828ca81a0c50be1d3431fe36db680e9a596b42086b206b5fda49b9a52a0ee1","implementationDigest":"sha256:2253465cea11924c0a3b0b32f0c0b31edf9784fad87e1f23634a19c63bc3eca8","instanceId":"protocol-author.development-artifact-quarantine.instance","principalId":"protocol-author.development-artifact-quarantine","role":"protocol_author"},"schemaVersion":1}
